{
  "$schema": "https://json-schema.org/draft/2020-12/schema",
  "$id": "https://raw.githubusercontent.com/NextProb/nextprob-plugin-registry/main/schemas/owners.schema.json",
  "title": "NextProb plugin ownership",
  "description": "Reviewed ownership mapping in owners.json. It defines maintainers, official namespaces, publishers, and plugin namespaces. Cross-file rules that JSON Schema cannot express are enforced by the registry validator: official namespaces must resolve to official publishers, official publishers must own at least one official namespace, namespace values must reference defined publishers, and non-official publishers must not own official namespaces.",
  "type": "object",
  "required": ["schemaVersion", "maintainers", "officialNamespaces", "publishers", "namespaces"],
  "properties": {
    "schemaVersion": {
      "const": 1,
      "description": "Ownership file schema version."
    },
    "maintainers": {
      "type": "array",
      "minItems": 1,
      "uniqueItems": true,
      "items": {
        "type": "string",
        "pattern": "^[a-z0-9](?:[a-z0-9-]*[a-z0-9])?$"
      },
      "description": "Non-empty list of lowercase GitHub logins allowed to review ownership and manage maintainers."
    },
    "officialNamespaces": {
      "type": "array",
      "uniqueItems": true,
      "items": {
        "type": "string",
        "pattern": "^(?!(?:[Cc][Oo][Nn]|[Pp][Rr][Nn]|[Aa][Uu][Xx]|[Nn][Uu][Ll]|[Cc][Oo][Mm][1-9]|[Ll][Pp][Tt][1-9])(?:\\.|$))(?!.*\\.$)[a-zA-Z0-9][a-zA-Z0-9._-]{0,79}$"
      },
      "description": "Namespaces reserved for official plugins. Every entry must be a key in namespaces whose publisher has official set to true."
    },
    "publishers": {
      "type": "object",
      "minProperties": 1,
      "propertyNames": {
        "pattern": "^(?!(?:[Cc][Oo][Nn]|[Pp][Rr][Nn]|[Aa][Uu][Xx]|[Nn][Uu][Ll]|[Cc][Oo][Mm][1-9]|[Ll][Pp][Tt][1-9])(?:\\.|$))(?!.*\\.$)[a-zA-Z0-9][a-zA-Z0-9._-]{0,79}$"
      },
      "additionalProperties": {
        "$ref": "#/$defs/publisher"
      },
      "description": "Publisher definitions keyed by publisher id."
    },
    "namespaces": {
      "type": "object",
      "minProperties": 1,
      "propertyNames": {
        "pattern": "^(?!(?:[Cc][Oo][Nn]|[Pp][Rr][Nn]|[Aa][Uu][Xx]|[Nn][Uu][Ll]|[Cc][Oo][Mm][1-9]|[Ll][Pp][Tt][1-9])(?:\\.|$))(?!.*\\.$)[a-zA-Z0-9][a-zA-Z0-9._-]{0,79}$"
      },
      "additionalProperties": {
        "type": "string",
        "pattern": "^(?!(?:[Cc][Oo][Nn]|[Pp][Rr][Nn]|[Aa][Uu][Xx]|[Nn][Uu][Ll]|[Cc][Oo][Mm][1-9]|[Ll][Pp][Tt][1-9])(?:\\.|$))(?!.*\\.$)[a-zA-Z0-9][a-zA-Z0-9._-]{0,79}$"
      },
      "description": "Namespace-to-publisher mapping. Keys are matched against plugin ids at dot boundaries; the longest match wins. Values must be keys in publishers."
    },
    "plugins": {
      "type": "object",
      "propertyNames": {
        "pattern": "^(?!(?:[Cc][Oo][Nn]|[Pp][Rr][Nn]|[Aa][Uu][Xx]|[Nn][Uu][Ll]|[Cc][Oo][Mm][1-9]|[Ll][Pp][Tt][1-9])(?:\\.|$))(?!.*\\.$)[a-zA-Z0-9][a-zA-Z0-9._-]{0,79}$"
      },
      "additionalProperties": {
        "type": "string",
        "pattern": "^(?!(?:[Cc][Oo][Nn]|[Pp][Rr][Nn]|[Aa][Uu][Xx]|[Nn][Uu][Ll]|[Cc][Oo][Mm][1-9]|[Ll][Pp][Tt][1-9])(?:\\.|$))(?!.*\\.$)[a-zA-Z0-9][a-zA-Z0-9._-]{0,79}$"
      },
      "description": "Optional exact plugin-id ownership overrides. Values must be keys in publishers."
    }
  },
  "additionalProperties": false,
  "$defs": {
    "publisher": {
      "type": "object",
      "required": ["displayName", "official", "github", "url"],
      "properties": {
        "displayName": {
          "type": "string",
          "minLength": 1,
          "maxLength": 200,
          "description": "Human-readable publisher name."
        },
        "official": {
          "type": "boolean",
          "description": "Whether this publisher is official. Official status is derived from this reviewed file, never from author-supplied metadata."
        },
        "github": {
          "type": "array",
          "minItems": 1,
          "uniqueItems": true,
          "items": {
            "type": "string",
            "pattern": "^[a-z0-9](?:[a-z0-9-]*[a-z0-9])?$"
          },
          "description": "Lowercase GitHub logins allowed to submit changes for this publisher's plugins."
        },
        "url": {
          "type": "string",
          "format": "uri",
          "description": "Publisher homepage or organization URL."
        }
      },
      "additionalProperties": false
    }
  }
}
